{
  "$schema": "http://json-schema.org/draft-07/schema#",
  "title": "item",
  "type": "object",
  "properties": {
    "organization_id": {
      "$ref": "#/definitions/UInt"
    },
    "project_id": {
      "$ref": "#/definitions/UInt"
    },
    "trace_id": {
      "$ref": "#/definitions/UUID"
    },
    "item_id": {
      "$ref": "#/definitions/UInt"
    },
    "item_type": {
      "type": "integer",
      "enum": [1, 2, 3]
    },
    "attributes": {
      "$ref": "#/definitions/Attributes"
    },
    "received": {
      "$ref": "#/definitions/Timestamp"
    },
    "retention_days": {
      "$ref": "#/definitions/UInt"
    }
  },
  "required": [
    "organization_id",
    "project_id",
    "trace_id",
    "item_id",
    "item_type",
    "attributes",
    "received",
    "retention_days"
  ],
  "definitions": {
    "Attributes": {
      "type": "object"
    },
    "UUID": {
      "type": "string",
      "minLength": 32,
      "maxLength": 36
    },
    "UInt": {
      "type": "integer",
      "minimum": 0
    },
    "Timestamp": {
      "type": "number",
      "minimum": 0
    }
  }
}
