{
  "organization_id": 1,
  "project_id": 1,
  "trace_id": "bf08190abab048fdb5cc5bf815787f59",
  "item_id": 1234567890123456,
  "item_type": 1,
  "attributes": {
    "sentry.environment": "production",
    "sentry.is_segment": true,
    "sentry.start_timestamp": 1741792974.123456,
    "http.response.status_code": 200
  },
  "retention_days": 90,
  "received": 1741792974
}
